{
  "$schema": "https://open-game-stack.github.io/open-game-stack-registry/schema/games/versions",
  "@context": "https://schema.org/",
  "@type": "SoftwareApplication",
  "@id": "https://open-game-stack.github.io/open-game-stack-registry/games/space-quest/versions/1.1.0",
  "name": "Space Quest 1.1.0",
  "version": "1.1.0",
  "datePublished": "2025-02-20",
  "releaseNotes": "Improves performance and adds a new mission briefing.",
  "isPartOf": {
    "@id": "https://open-game-stack.github.io/open-game-stack-registry/games/space-quest",
    "@type": "SoftwareApplication",
    "name": "Space Quest"
  },
  "associatedMedia": [
    {
      "@type": "MediaObject",
      "name": "Space Quest 1.1.0 macOS",
      "encodingFormat": "text/plain",
      "license": "https://spdx.org/licenses/MIT.html",
      "operatingSystem": [
        "macos"
      ],
      "processorRequirements": [
        "x86_64",
        "arm64"
      ],
      "contentSize": 44,
      "sha256": "a2d40a411a2036e8f8caccc3bbc1ab21b6abaa78b5c721095404d2f9f23fec84",
      "contentUrl": "https://open-game-stack.github.io/open-game-stack-registry/games/space-quest/versions/1.1.0/assets/space-quest-1.1.0-macos.txt"
    }
  ]
}